{
  "changes": [
    { "entity": "node", "data": {
      "id": "10000000-0000-4000-8000-000000000001", "type": "concept", "title": "Derivata", "body_md": "Il limite.",
      "area": "studio", "tags": ["analisi"], "version": 3, "created_at": "2026-10-14T09:00:00.123456+00:00",
      "updated_at": "2026-10-14T11:00:00.5+00:00", "deleted_at": null, "device_id": "pc-9f8e7d6c", "server_seq": 50 } },
    { "entity": "node_version", "data": {
      "id": "10000000-0000-4000-8000-0000000000c1", "node_id": "10000000-0000-4000-8000-000000000001", "version": 3,
      "body_md": "Il limite.", "tags": ["analisi"], "created_at": "2026-10-14T11:00:00+00:00", "device_id": "pc-9f8e7d6c", "server_seq": 51 } },
    { "entity": "edge", "data": {
      "id": "10000000-0000-4000-8000-0000000000e1", "source_id": "10000000-0000-4000-8000-000000000001",
      "target_id": "10000000-0000-4000-8000-000000000002", "kind": "link", "label": null, "version": 1,
      "created_at": "2026-10-14T09:05:00+00:00", "deleted_at": null, "server_seq": 52 } },
    { "entity": "ink_page", "data": {
      "id": "10000000-0000-4000-8000-0000000000a1", "node_id": "10000000-0000-4000-8000-000000000001", "page_no": 0,
      "background": "blank", "ink_data": "QUJDRA==", "attachment_id": null, "pdf_page": null, "version": 1,
      "created_at": "2026-10-14T09:10:00+00:00", "updated_at": "2026-10-14T09:10:00+00:00", "deleted_at": null,
      "device_id": "pc-9f8e7d6c", "server_seq": 53 } },
    { "entity": "attachment", "data": {
      "id": "10000000-0000-4000-8000-0000000000b1", "node_id": null, "kind": "pdf", "storage_path": "10000000-0000-4000-8000-0000000000b1",
      "size_bytes": 104857600, "page_count": null, "sha256": "abababababababababababababababababababababababababababababababab",
      "file_name": "Analisi.pdf", "part_count": 3, "version": 1, "created_at": "2026-10-14T09:15:00+00:00",
      "updated_at": "2026-10-14T09:15:00+00:00", "deleted_at": null, "device_id": "ipad-1a2b3c4d", "server_seq": 54 } },
    { "entity": "purged", "data": { "entity": "node", "id": "10000000-0000-4000-8000-0000000000d1", "purged_at": "2026-10-14T12:00:00+00:00", "server_seq": 55 } },
    { "entity": "purged", "data": { "entity": "chat", "id": "10000000-0000-4000-8000-0000000000d2", "purged_at": "2026-10-14T12:00:00+00:00", "server_seq": 56 } },
    { "entity": "entita_del_futuro", "data": { "id": "10000000-0000-4000-8000-0000000000d3", "campo": 1 } }
  ],
  "cursor": 56,
  "has_more": false,
  "epoch": 1
}
